{
  "schema_version": "scs.operator-tool-surface.v1",
  "observation_id": "OBS-TOOL-SURFACE-2026-10-16-01",
  "observed_on": "2026-10-16",
  "scope": "Tool definitions exposed in this operator run. This is a source-discovery snapshot only; it does not prove connection status, resource access, or authorization.",
  "total_tool_definitions": 1098,
  "resource_access_confirmed": false,
  "namespaces": [
    {
      "namespace": "Aave",
      "tool_count": 53,
      "tool_names": [
        "mcp__Aave__cancel_order",
        "mcp__Aave__get_aave_guide",
        "mcp__Aave__get_apy_history",
        "mcp__Aave__get_asset_history",
        "mcp__Aave__get_chains",
        "mcp__Aave__get_emode_categories",
        "mcp__Aave__get_governance_proposal",
        "mcp__Aave__get_hub_assets",
        "mcp__Aave__get_hubs",
        "mcp__Aave__get_interest_rate_model",
        "mcp__Aave__get_market_history",
        "mcp__Aave__get_markets",
        "mcp__Aave__get_multichain_asset",
        "mcp__Aave__get_order_status",
        "mcp__Aave__get_pending_orders",
        "mcp__Aave__get_position_items",
        "mcp__Aave__get_proposal_payloads",
        "mcp__Aave__get_proposal_votes",
        "mcp__Aave__get_protocol_history",
        "mcp__Aave__get_reserve_details",
        "mcp__Aave__get_reserve_holders",
        "mcp__Aave__get_risk_premium",
        "mcp__Aave__get_safety_module",
        "mcp__Aave__get_sgho_preview",
        "mcp__Aave__get_sgho_vault",
        "mcp__Aave__get_spoke_configs",
        "mcp__Aave__get_started",
        "mcp__Aave__get_swap_quote",
        "mcp__Aave__get_swappable_tokens",
        "mcp__Aave__get_transaction_processed",
        "mcp__Aave__get_user_activity",
        "mcp__Aave__get_user_positions",
        "mcp__Aave__get_user_rewards",
        "mcp__Aave__get_user_summary",
        "mcp__Aave__get_user_summary_history",
        "mcp__Aave__get_user_vote",
        "mcp__Aave__get_vault_activity",
        "mcp__Aave__get_vault_preview",
        "mcp__Aave__get_vaults",
        "mcp__Aave__get_wallet_balances",
        "mcp__Aave__prepare_action",
        "mcp__Aave__prepare_cancel_order",
        "mcp__Aave__prepare_claim_rewards",
        "mcp__Aave__prepare_liquidation",
        "mcp__Aave__prepare_order",
        "mcp__Aave__prepare_set_collateral",
        "mcp__Aave__prepare_set_emode",
        "mcp__Aave__prepare_sgho_action",
        "mcp__Aave__prepare_stkgho_migrate",
        "mcp__Aave__prepare_vault_action",
        "mcp__Aave__preview_action",
        "mcp__Aave__search_governance_proposals",
        "mcp__Aave__submit_signed_order"
      ]
    },
    {
      "namespace": "Airtable",
      "tool_count": 47,
      "tool_names": [
        "mcp__Airtable__analyze_table",
        "mcp__Airtable__create_automation",
        "mcp__Airtable__create_base",
        "mcp__Airtable__create_field",
        "mcp__Airtable__create_interface",
        "mcp__Airtable__create_page",
        "mcp__Airtable__create_record_comment",
        "mcp__Airtable__create_records_for_table",
        "mcp__Airtable__create_table",
        "mcp__Airtable__delete_automation",
        "mcp__Airtable__delete_interface",
        "mcp__Airtable__delete_page",
        "mcp__Airtable__delete_records_for_table",
        "mcp__Airtable__delete_table",
        "mcp__Airtable__describe_page_element",
        "mcp__Airtable__describe_page_type",
        "mcp__Airtable__display_records_for_table",
        "mcp__Airtable__fetch_automation_input_data",
        "mcp__Airtable__get_automation",
        "mcp__Airtable__get_create_automation_instructions",
        "mcp__Airtable__get_form_schema",
        "mcp__Airtable__get_record_for_page",
        "mcp__Airtable__get_table_schema",
        "mcp__Airtable__list_automation_runs",
        "mcp__Airtable__list_automations",
        "mcp__Airtable__list_bases",
        "mcp__Airtable__list_external_accounts",
        "mcp__Airtable__list_pages_for_base",
        "mcp__Airtable__list_record_comments",
        "mcp__Airtable__list_records_for_page",
        "mcp__Airtable__list_records_for_table",
        "mcp__Airtable__list_secrets",
        "mcp__Airtable__list_tables_for_base",
        "mcp__Airtable__list_views_for_table",
        "mcp__Airtable__list_workspaces",
        "mcp__Airtable__ping",
        "mcp__Airtable__publish_interface",
        "mcp__Airtable__revert_action",
        "mcp__Airtable__search_bases",
        "mcp__Airtable__search_candidate_linked_records",
        "mcp__Airtable__search_records",
        "mcp__Airtable__submit_form",
        "mcp__Airtable__test_automation_webhook_trigger",
        "mcp__Airtable__update_automation",
        "mcp__Airtable__update_field",
        "mcp__Airtable__update_records_for_table",
        "mcp__Airtable__update_table"
      ]
    },
    {
      "namespace": "AppDeploy",
      "tool_count": 21,
      "tool_names": [
        "mcp__AppDeploy__apply_app_version",
        "mcp__AppDeploy__configure_custom_domain",
        "mcp__AppDeploy__create_secret_entry",
        "mcp__AppDeploy__delete_app",
        "mcp__AppDeploy__delete_app_secrets",
        "mcp__AppDeploy__deploy_app",
        "mcp__AppDeploy__get_app_status",
        "mcp__AppDeploy__get_app_versions",
        "mcp__AppDeploy__get_appdeploy_sdk_reference",
        "mcp__AppDeploy__get_apps",
        "mcp__AppDeploy__get_custom_domain_instructions",
        "mcp__AppDeploy__get_deploy_instructions",
        "mcp__AppDeploy__get_e2e_qa_run_details",
        "mcp__AppDeploy__get_mode_reminder_status",
        "mcp__AppDeploy__get_secret_entry_status",
        "mcp__AppDeploy__list_app_secrets",
        "mcp__AppDeploy__set_app_secrets",
        "mcp__AppDeploy__src_glob",
        "mcp__AppDeploy__src_grep",
        "mcp__AppDeploy__src_read",
        "mcp__AppDeploy__upload_assets"
      ]
    },
    {
      "namespace": "Automations",
      "tool_count": 7,
      "tool_names": [
        "mcp__Automations__create",
        "mcp__Automations__list",
        "mcp__Automations__list_event_sources",
        "mcp__Automations__notify_parent",
        "mcp__Automations__peek",
        "mcp__Automations__run_now",
        "mcp__Automations__update"
      ]
    },
    {
      "namespace": "Canva",
      "tool_count": 40,
      "tool_names": [
        "mcp__Canva__autofill_design",
        "mcp__Canva__cancel_editing_transaction",
        "mcp__Canva__commit_editing_transaction",
        "mcp__Canva__copy_design",
        "mcp__Canva__create_design",
        "mcp__Canva__create_design_from_brand_template",
        "mcp__Canva__create_design_from_candidate",
        "mcp__Canva__create_folder",
        "mcp__Canva__create_upload_url",
        "mcp__Canva__fetch",
        "mcp__Canva__generate_design",
        "mcp__Canva__generate_image",
        "mcp__Canva__get_assets",
        "mcp__Canva__get_brand_template_dataset",
        "mcp__Canva__get_create_design_async_job",
        "mcp__Canva__get_design",
        "mcp__Canva__get_design_content",
        "mcp__Canva__get_design_dataset",
        "mcp__Canva__get_design_pages",
        "mcp__Canva__get_design_thumbnail",
        "mcp__Canva__get_generate_image_job",
        "mcp__Canva__get_presenter_notes",
        "mcp__Canva__image_to_design",
        "mcp__Canva__import_design_from_url",
        "mcp__Canva__list_brand_kits",
        "mcp__Canva__list_comments",
        "mcp__Canva__list_folder_items",
        "mcp__Canva__merge_designs",
        "mcp__Canva__move_item_to_folder",
        "mcp__Canva__perform_editing_operations",
        "mcp__Canva__prepare_design_generation",
        "mcp__Canva__remove_background",
        "mcp__Canva__resize_design",
        "mcp__Canva__resolve_shortlink",
        "mcp__Canva__search",
        "mcp__Canva__search_brand_templates",
        "mcp__Canva__search_designs",
        "mcp__Canva__search_folders",
        "mcp__Canva__start_editing_transaction",
        "mcp__Canva__upload_asset_from_url"
      ]
    },
    {
      "namespace": "CodeQR___Link_and_QR_Analytics",
      "tool_count": 14,
      "tool_names": [
        "mcp__CodeQR___Link_and_QR_Analytics__create_link",
        "mcp__CodeQR___Link_and_QR_Analytics__create_qrcode",
        "mcp__CodeQR___Link_and_QR_Analytics__create_tag",
        "mcp__CodeQR___Link_and_QR_Analytics__delete_link",
        "mcp__CodeQR___Link_and_QR_Analytics__delete_qrcode",
        "mcp__CodeQR___Link_and_QR_Analytics__get_analytics",
        "mcp__CodeQR___Link_and_QR_Analytics__get_link_info",
        "mcp__CodeQR___Link_and_QR_Analytics__get_workspace",
        "mcp__CodeQR___Link_and_QR_Analytics__list_domains",
        "mcp__CodeQR___Link_and_QR_Analytics__list_links",
        "mcp__CodeQR___Link_and_QR_Analytics__list_qrcodes",
        "mcp__CodeQR___Link_and_QR_Analytics__list_tags",
        "mcp__CodeQR___Link_and_QR_Analytics__update_link",
        "mcp__CodeQR___Link_and_QR_Analytics__update_qrcode"
      ]
    },
    {
      "namespace": "Consensus",
      "tool_count": 4,
      "tool_names": [
        "mcp__Consensus__fetch",
        "mcp__Consensus__find_threads",
        "mcp__Consensus__get_thread",
        "mcp__Consensus__search"
      ]
    },
    {
      "namespace": "Context7",
      "tool_count": 2,
      "tool_names": [
        "mcp__Context7__query_docs",
        "mcp__Context7__resolve_library_id"
      ]
    },
    {
      "namespace": "Daily_Leveling",
      "tool_count": 10,
      "tool_names": [
        "mcp__Daily_Leveling__complete_quest",
        "mcp__Daily_Leveling__create_goal",
        "mcp__Daily_Leveling__create_quest",
        "mcp__Daily_Leveling__fetch",
        "mcp__Daily_Leveling__get_quest_board",
        "mcp__Daily_Leveling__get_stats",
        "mcp__Daily_Leveling__list_goals",
        "mcp__Daily_Leveling__list_quests",
        "mcp__Daily_Leveling__open_quest_board",
        "mcp__Daily_Leveling__search"
      ]
    },
    {
      "namespace": "Dependency_Upgrade_Plan",